{
  "name": "Bright Sky",
  "appMenu": {
    "menuButton": {
      "background": "#00b4d8",
      "hover": "cyan.600",
      "border": "cyan.500",
      "text": "white"
    },
    "closeButton": {
      "color": "white"
    },
    "drawer": {
      "background": "#00b4d8",
      "appText": "white",
      "routeLink": "white"
    },
    "copyright": {
      "color": "white",
      "hoverColor": "cyan.100"
    }
  },
  "general": {
    "background": "gray.900"
  },
  "chordsIndexPage": {
    "background": "#00b4d8",
    "searchBar": {
      "background": "blackAlpha.100",
      "color": "white",
      "border": "white",
      "focusBorder": "cyan.500"
    }
  },
  "chord": {
    "border": "white",
    "background": "#00b4d8",
    "dividers": "white",
    "title": "white"
  },
  "fret": {
    "background": "blackAlpha.300",
    "dividers": "white",
    "muted": {
      "background": "red.500",
      "border": "red.600",
      "color": "white"
    },
    "finger": {
      "background": "cyan.500",
      "border": "cyan.600",
      "color": "white"
    }
  },
  "songCard": {
    "background": "blackAlpha.400",
    "border": "cyan.600",
    "hover": {
      "background": "blackAlpha.500"
    },
    "cover": {
      "border": "cyan.500",
      "hover": {
        "background": "rgba(0,0,0,0.6)",
        "play": {
          "background": "cyan.600",
          "text": "white"
        }
      }
    },
    "text": {
      "number": "white",
      "title": "white",
      "authors": "white",
      "typeTags": "white"
    },
    "chords": {
      "pick": "white",
      "popover": {
        "border": "white",
        "background": "gray.900",
        "arrow": "white",
        "tag": {
          "background": "cyan.600",
          "border": "cyan.400",
          "text": "white"
        }
      }
    }
  },
  "song": {
    "background": "#00b4d8",
    "header": {
      "title": "white",
      "artists": "white",
      "typeTags": "white",
      "coverBorder": "cyan.500"
    },
    "capo": {
      "background": "cyan.600",
      "border": "cyan.500",
      "text": "white"
    },
    "segments": {
      "background": "blackAlpha.400",
      "divider": "white",
      "item": {
        "title": "white",
        "times": {
          "background": "cyan.600",
          "color": "white"
        },
        "chordsPattern": {
          "background": "cyan.600",
          "color": "white",
          "divider": "white",
          "times": "white",
          "chord": {
            "background": "cyan.600",
            "color": "white",
            "segment": {
              "popover": {
                "background": "gray.900",
                "arrow": "white",
                "border": "white",
                "closeButton": "white"
              },
              "times": "white",
              "pattern": "white"
            },
            "times": {
              "background": "cyan.500",
              "color": "white"
            }
          }
        },
        "stringsPattern": {
          "divider": "white",
          "stringNames": "white",
          "fret": {
            "background": "cyan.600",
            "border": "cyan.900",
            "text": "white"
          },
          "filler": "white"
        }
      }
    },
    "resources": {
      "title": "white",
      "item": {
        "note": "white",
        "alias": "white",
        "author": "white"
      }
    }
  },
  "songsIndexPage": {
    "background": "#00b4d8",
    "searchBar": {
      "background": "blackAlpha.100",
      "color": "white",
      "border": "white",
      "focusBorder": "cyan.500"
    }
  },
  "settings": {
    "title": "white",
    "themePicker": {
      "background": "#00b4d8",
      "title": "white",
      "item": {
        "background": "blackAlpha.400",
        "hoverBackground": "blackAlpha.500",
        "border": "cyan.800",
        "indexColor": "white",
        "colorBoxBorder": "gray.900",
        "title": "white"
      }
    }
  }
}
